{
  "run_id": "issue-44",
  "issue": {
    "number": 44,
    "title": "[Harness] Inbox 처리 정책 문서화",
    "url": "https://github.com/tkyoun0421/la-bie-belle/issues/44"
  },
  "status": "reviewed",
  "attempt": 1,
  "artifacts": {
    "task_spec": "task-spec.md",
    "plan": "plan.md",
    "spec": "spec.md",
    "implementation_notes": "implementation-notes.md",
    "verification": "verification.md",
    "review_score": "review-score.json",
    "review": "review.md"
  },
  "changed_files": [
    ".agents/harness/inbox-policy.md",
    ".agents/inbox.md",
    ".agents/harness/workflows/issue-execution.workflow.md",
    ".agents/harness/agents/draft-pr.agent.md",
    ".agents/skills/ai-harness-draft-pr/SKILL.md",
    ".agents/skills/ai-harness-capture/SKILL.md",
    ".agents/skills/ai-harness-status/SKILL.md"
  ],
  "scores": [
    {
      "score_id": "issue-44-review-attempt-1",
      "total_score": 92,
      "decision": "PASS",
      "file": "review-score.json"
    }
  ],
  "created_at": "2026-05-12T05:15:41.378Z",
  "updated_at": "2026-05-12T05:30:00.000Z"
}
